{
  "theme": "Serum vitamin C cho da dầu mụn, 20-28 tuổi",
  "brand": {
    "name": "Cocoon Vietnam",
    "toneOfVoice": "clean, scientific nhưng gần gũi, sustainable",
    "palette": {
      "primary": "#90EE90",
      "accent": "#FFFFFF",
      "bg": "#F5F5DC"
    },
    "fonts": {
      "display": "Playfair Display",
      "body": "Inter"
    },
    "logoUrl": null,
    "voiceId": "vi-female-young",
    "claimsAllowed": ["làm sáng", "hỗ trợ giảm mụn", "thành phần thiên nhiên"],
    "claimsForbidden": ["chữa khỏi mụn", "100% hiệu quả", "thuốc", "trị mụn tận gốc"]
  },
  "audience": {
    "segment": "gen-z Vietnam skincare",
    "age": "20-28",
    "locale": "vi-VN"
  },
  "platform": "tiktok",
  "constraints": {
    "lengthSec": 30,
    "aspect": ["9:16", "1:1"],
    "mustInclude": ["serum", "da sáng"],
    "mustAvoid": ["kem trộn", "xóa mờ sẹo"]
  },
  "moodboardUrls": [],
  "variantsTarget": 2
}
